{
  "$schema": "https://frootai.dev/schemas/solution-play-certification-evidence.v1.json",
  "schema_version": "1.0.0",
  "subject": {
    "play_id": "09",
    "slug": "09-ai-search-portal",
    "canonical_id": "frootai__09-ai-search-portal",
    "repository": "https://github.com/frootai/frootai",
    "commit_sha": "5c2f1068f62a65a242e7460f6dc6aa85bc8e163a",
    "content_sha256": "e1d2afce664bbd7110236dd5a65362c259a11150dddcb4670d122c9f38b48f86",
    "manifest_sha256": "7a5c4fb7ca6239c8411981fafd65d8417ef0192ac5bd62317e93fd992d39fc9a",
    "iac_sha256": "ebfb60138dc526f12a98f8f075dd135213c0992e6a8a262c05b86a9f82d28c9f",
    "evaluation_dataset_sha256": "67ca940aaab02795b088b9bd9199e3e551d620ede94efbd4401435d674ff2d0e"
  },
  "policy": {
    "profile": "design-v1",
    "profile_sha256": "b0bc3c9e6fb86282d610e35b01b22e1d544f683f894f5ad73f2913aed7d7d0d0"
  },
  "generated_at": "2026-07-27T06:26:06.692Z",
  "stages": {
    "designed": {
      "status": "passed",
      "generated_at": "2026-07-27T06:26:06.692Z",
      "expires_at": "2026-08-26T06:26:06.692Z",
      "provenance": {
        "workflow": "local",
        "run_id": "local",
        "attempt": 1
      },
      "environment": {
        "class": "local",
        "tools": {
          "node": "v24.18.0"
        }
      },
      "checks": [
        {
          "id": "manifest",
          "status": "passed",
          "blocking": true,
          "output_sha256": "6ac6ea3cc7a5d651206806909a7fd6cb919d38fca017269c23a1468698dbae60",
          "metrics": {
            "detail": "engine loaded 09-ai-search-portal"
          }
        },
        {
          "id": "references",
          "status": "passed",
          "blocking": true,
          "output_sha256": "860349291c97b5d74c32474d2d069f363387409acf79c1de7f0565c719e2b5d3",
          "metrics": {
            "detail": "all declared references resolve"
          }
        },
        {
          "id": "architecture",
          "status": "passed",
          "blocking": true,
          "output_sha256": "2d3f6064549b5e08b5c2358372a1083d445fd16eeb411e84d898a74e55da25ca",
          "metrics": {
            "detail": "diagram, service roles, and security are declared"
          }
        },
        {
          "id": "cost",
          "status": "passed",
          "blocking": true,
          "output_sha256": "ed2d3273acb8bbfc77e3c68d02e284233ad4b89570cb019e09c81477bb453655",
          "metrics": {
            "detail": "component totals reconcile for dev, prod, and enterprise"
          }
        },
        {
          "id": "iac-declaration",
          "status": "passed",
          "blocking": true,
          "output_sha256": "05e0cfa7dce53e00eed918f313aceec9552f03be852ab8a9c7f7e6ee6bd10895",
          "metrics": {
            "detail": "./infra/main.bicep"
          }
        },
        {
          "id": "evaluation-declaration",
          "status": "passed",
          "blocking": true,
          "output_sha256": "3f3e286fc5b64213c1eb925a2041fd38e6f045ec4c5cf7f7a57e5ead4a642db4",
          "metrics": {
            "detail": "evaluation entry point exists"
          }
        },
        {
          "id": "observability-declaration",
          "status": "passed",
          "blocking": true,
          "output_sha256": "87c4f1fc19a687e2449603e5671695f27fd8c187c5fff7b738a324a9f75206c3",
          "metrics": {
            "detail": "observability service is present in architecture"
          }
        }
      ],
      "artifacts": [
        {
          "type": "manifest",
          "url": "solution-plays/09-ai-search-portal/spec/fai-manifest.json",
          "sha256": "7a5c4fb7ca6239c8411981fafd65d8417ef0192ac5bd62317e93fd992d39fc9a",
          "media_type": "application/json"
        },
        {
          "type": "architecture",
          "url": "solution-plays/09-ai-search-portal/architecture.md",
          "sha256": "b4f4b736f5793637041871a2a3304c8e0c64a837490ac5b298848124b944d777",
          "media_type": "text/markdown"
        },
        {
          "type": "cost",
          "url": "solution-plays/09-ai-search-portal/cost.json",
          "sha256": "3e98185082a223172d71a22af91d92b06289ed7126895666ae60618518be1eb8",
          "media_type": "application/json"
        }
      ]
    }
  }
}
