{
  "$schema": "https://frootai.dev/schemas/solution-play-certification-evidence.v1.json",
  "schema_version": "1.0.0",
  "subject": {
    "play_id": "88",
    "slug": "88-visual-product-search",
    "canonical_id": "frootai__88-visual-product-search",
    "repository": "https://github.com/frootai/frootai",
    "commit_sha": "5c2f1068f62a65a242e7460f6dc6aa85bc8e163a",
    "content_sha256": "e0903670d27642911a5189058a4e7616dbe38105b84715b34db3becb9cb09858",
    "manifest_sha256": "cd44caa5dae858c9036202a95c3f84fde0dc7ae9558580dc125b4d04a4b3f9cd",
    "iac_sha256": "950f8f1e79fc421e06b6700b810e25554b591dad66c05dcce513c14bd47f2c94",
    "evaluation_dataset_sha256": "eeceb7198f72f983579cc6ddbda9e0caebbe52f5193a42d7bb8e0ad23088f197"
  },
  "policy": {
    "profile": "design-v1",
    "profile_sha256": "b0bc3c9e6fb86282d610e35b01b22e1d544f683f894f5ad73f2913aed7d7d0d0"
  },
  "generated_at": "2026-07-27T06:26:06.692Z",
  "stages": {
    "designed": {
      "status": "passed",
      "generated_at": "2026-07-27T06:26:06.692Z",
      "expires_at": "2026-08-26T06:26:06.692Z",
      "provenance": {
        "workflow": "local",
        "run_id": "local",
        "attempt": 1
      },
      "environment": {
        "class": "local",
        "tools": {
          "node": "v24.18.0"
        }
      },
      "checks": [
        {
          "id": "manifest",
          "status": "passed",
          "blocking": true,
          "output_sha256": "d218703810bd8730934b2f530e126025060527a436265a7130aeab4e9f631fea",
          "metrics": {
            "detail": "engine loaded 88-visual-product-search"
          }
        },
        {
          "id": "references",
          "status": "passed",
          "blocking": true,
          "output_sha256": "860349291c97b5d74c32474d2d069f363387409acf79c1de7f0565c719e2b5d3",
          "metrics": {
            "detail": "all declared references resolve"
          }
        },
        {
          "id": "architecture",
          "status": "passed",
          "blocking": true,
          "output_sha256": "2d3f6064549b5e08b5c2358372a1083d445fd16eeb411e84d898a74e55da25ca",
          "metrics": {
            "detail": "diagram, service roles, and security are declared"
          }
        },
        {
          "id": "cost",
          "status": "passed",
          "blocking": true,
          "output_sha256": "ed2d3273acb8bbfc77e3c68d02e284233ad4b89570cb019e09c81477bb453655",
          "metrics": {
            "detail": "component totals reconcile for dev, prod, and enterprise"
          }
        },
        {
          "id": "iac-declaration",
          "status": "passed",
          "blocking": true,
          "output_sha256": "533beeafb83e3ff2ec9bf221618dabef7a8b1c6e79fe84c500d8df54d6b50656",
          "metrics": {
            "detail": "infra/main.bicep"
          }
        },
        {
          "id": "evaluation-declaration",
          "status": "passed",
          "blocking": true,
          "output_sha256": "3f3e286fc5b64213c1eb925a2041fd38e6f045ec4c5cf7f7a57e5ead4a642db4",
          "metrics": {
            "detail": "evaluation entry point exists"
          }
        },
        {
          "id": "observability-declaration",
          "status": "passed",
          "blocking": true,
          "output_sha256": "87c4f1fc19a687e2449603e5671695f27fd8c187c5fff7b738a324a9f75206c3",
          "metrics": {
            "detail": "observability service is present in architecture"
          }
        }
      ],
      "artifacts": [
        {
          "type": "manifest",
          "url": "solution-plays/88-visual-product-search/spec/fai-manifest.json",
          "sha256": "cd44caa5dae858c9036202a95c3f84fde0dc7ae9558580dc125b4d04a4b3f9cd",
          "media_type": "application/json"
        },
        {
          "type": "architecture",
          "url": "solution-plays/88-visual-product-search/architecture.md",
          "sha256": "d4a2325d27db6bc1767b5fce7c9abab78aa02c99488a52344486e57c35700a54",
          "media_type": "text/markdown"
        },
        {
          "type": "cost",
          "url": "solution-plays/88-visual-product-search/cost.json",
          "sha256": "a66f23c44f9aac5651175471678afb18ec5b76ddcb0cf4cc4e92df61e5e3d1a5",
          "media_type": "application/json"
        }
      ]
    }
  }
}
