{
  "$schema": "https://frootai.dev/schemas/solution-play-certification-evidence.v1.json",
  "schema_version": "1.0.0",
  "subject": {
    "play_id": "82",
    "slug": "82-construction-safety-ai",
    "canonical_id": "frootai__82-construction-safety-ai",
    "repository": "https://github.com/frootai/frootai",
    "commit_sha": "b189ed981c457918ff3b81c4c530b3dd47d5196c",
    "content_sha256": "529a619949b60cdc785756d1b8186bd9d27a7a7814eb4ce82c989fc516de68dc",
    "manifest_sha256": "beed4c28407341800f249487b9a39e76cd86a6d96ad4bc383c1c6462b329df17",
    "iac_sha256": "f6821e0c80fdec0aebc1cdf9f184e4a7022341a82249f664244325a529d82614",
    "evaluation_dataset_sha256": "c96ba82f3a0e2754a937775ee9f098ba4ea9fb61ad78e72f8072b7caf4453fde"
  },
  "policy": {
    "profile": "design-v1",
    "profile_sha256": "b0bc3c9e6fb86282d610e35b01b22e1d544f683f894f5ad73f2913aed7d7d0d0"
  },
  "generated_at": "2026-07-18T22:54:56.591Z",
  "stages": {
    "designed": {
      "status": "passed",
      "generated_at": "2026-07-18T22:54:56.591Z",
      "expires_at": "2026-08-17T22:54:56.591Z",
      "provenance": {
        "workflow": "local",
        "run_id": "local",
        "attempt": 1
      },
      "environment": {
        "class": "local",
        "tools": {
          "node": "v24.18.0"
        }
      },
      "checks": [
        {
          "id": "manifest",
          "status": "passed",
          "blocking": true,
          "output_sha256": "9e4f2b84a42a249a6fc3aafe32f45f313d8038bf9763c214e3d238e178ac19f8",
          "metrics": {
            "detail": "engine loaded 82-construction-safety-ai"
          }
        },
        {
          "id": "references",
          "status": "passed",
          "blocking": true,
          "output_sha256": "860349291c97b5d74c32474d2d069f363387409acf79c1de7f0565c719e2b5d3",
          "metrics": {
            "detail": "all declared references resolve"
          }
        },
        {
          "id": "architecture",
          "status": "passed",
          "blocking": true,
          "output_sha256": "2d3f6064549b5e08b5c2358372a1083d445fd16eeb411e84d898a74e55da25ca",
          "metrics": {
            "detail": "diagram, service roles, and security are declared"
          }
        },
        {
          "id": "cost",
          "status": "passed",
          "blocking": true,
          "output_sha256": "ed2d3273acb8bbfc77e3c68d02e284233ad4b89570cb019e09c81477bb453655",
          "metrics": {
            "detail": "component totals reconcile for dev, prod, and enterprise"
          }
        },
        {
          "id": "iac-declaration",
          "status": "passed",
          "blocking": true,
          "output_sha256": "533beeafb83e3ff2ec9bf221618dabef7a8b1c6e79fe84c500d8df54d6b50656",
          "metrics": {
            "detail": "infra/main.bicep"
          }
        },
        {
          "id": "evaluation-declaration",
          "status": "passed",
          "blocking": true,
          "output_sha256": "3f3e286fc5b64213c1eb925a2041fd38e6f045ec4c5cf7f7a57e5ead4a642db4",
          "metrics": {
            "detail": "evaluation entry point exists"
          }
        },
        {
          "id": "observability-declaration",
          "status": "passed",
          "blocking": true,
          "output_sha256": "87c4f1fc19a687e2449603e5671695f27fd8c187c5fff7b738a324a9f75206c3",
          "metrics": {
            "detail": "observability service is present in architecture"
          }
        }
      ],
      "artifacts": [
        {
          "type": "manifest",
          "url": "solution-plays/82-construction-safety-ai/spec/fai-manifest.json",
          "sha256": "beed4c28407341800f249487b9a39e76cd86a6d96ad4bc383c1c6462b329df17",
          "media_type": "application/json"
        },
        {
          "type": "architecture",
          "url": "solution-plays/82-construction-safety-ai/architecture.md",
          "sha256": "f9f13956d2a4eef73a73bb88f9eefab0647ed8a3c0165eda9402e0a60452456e",
          "media_type": "text/markdown"
        },
        {
          "type": "cost",
          "url": "solution-plays/82-construction-safety-ai/cost.json",
          "sha256": "ff183b24866382610b27440f8c9a987b751fa572c0c25905f4bf4139fe700fe3",
          "media_type": "application/json"
        }
      ]
    }
  }
}
