{
  "$schema": "https://frootai.dev/schemas/solution-play-certification-evidence.v1.json",
  "schema_version": "1.0.0",
  "subject": {
    "play_id": "14",
    "slug": "14-cost-optimized-ai-gateway",
    "canonical_id": "frootai__14-cost-optimized-ai-gateway",
    "repository": "https://github.com/frootai/frootai",
    "commit_sha": "5c2f1068f62a65a242e7460f6dc6aa85bc8e163a",
    "content_sha256": "3e6b3ba6e74e6311be758a6d9fc9b3a427b6e96c044b30cc3eb08114ea551dcd",
    "manifest_sha256": "78a41d427f198d5567b35461c74cf6081d0454b31d82850b5553ffa7fd3d6c11",
    "iac_sha256": "f038e351def11e306c69a12bf85a3ac67c136d5fb023920f7e18d0288311f744",
    "evaluation_dataset_sha256": "582d32d10d5e6de00b731d2fdb31df317f1c0360552e70221a3532ef1c0a1a32"
  },
  "policy": {
    "profile": "design-v1",
    "profile_sha256": "b0bc3c9e6fb86282d610e35b01b22e1d544f683f894f5ad73f2913aed7d7d0d0"
  },
  "generated_at": "2026-07-27T06:26:06.692Z",
  "stages": {
    "designed": {
      "status": "passed",
      "generated_at": "2026-07-27T06:26:06.692Z",
      "expires_at": "2026-08-26T06:26:06.692Z",
      "provenance": {
        "workflow": "local",
        "run_id": "local",
        "attempt": 1
      },
      "environment": {
        "class": "local",
        "tools": {
          "node": "v24.18.0"
        }
      },
      "checks": [
        {
          "id": "manifest",
          "status": "passed",
          "blocking": true,
          "output_sha256": "93ada44fa60a60b56f191667a81f44fce10678b0d64796a62222fb2a1c55220c",
          "metrics": {
            "detail": "engine loaded 14-cost-optimized-ai-gateway"
          }
        },
        {
          "id": "references",
          "status": "passed",
          "blocking": true,
          "output_sha256": "860349291c97b5d74c32474d2d069f363387409acf79c1de7f0565c719e2b5d3",
          "metrics": {
            "detail": "all declared references resolve"
          }
        },
        {
          "id": "architecture",
          "status": "passed",
          "blocking": true,
          "output_sha256": "2d3f6064549b5e08b5c2358372a1083d445fd16eeb411e84d898a74e55da25ca",
          "metrics": {
            "detail": "diagram, service roles, and security are declared"
          }
        },
        {
          "id": "cost",
          "status": "passed",
          "blocking": true,
          "output_sha256": "ed2d3273acb8bbfc77e3c68d02e284233ad4b89570cb019e09c81477bb453655",
          "metrics": {
            "detail": "component totals reconcile for dev, prod, and enterprise"
          }
        },
        {
          "id": "iac-declaration",
          "status": "passed",
          "blocking": true,
          "output_sha256": "05e0cfa7dce53e00eed918f313aceec9552f03be852ab8a9c7f7e6ee6bd10895",
          "metrics": {
            "detail": "./infra/main.bicep"
          }
        },
        {
          "id": "evaluation-declaration",
          "status": "passed",
          "blocking": true,
          "output_sha256": "3f3e286fc5b64213c1eb925a2041fd38e6f045ec4c5cf7f7a57e5ead4a642db4",
          "metrics": {
            "detail": "evaluation entry point exists"
          }
        },
        {
          "id": "observability-declaration",
          "status": "passed",
          "blocking": true,
          "output_sha256": "87c4f1fc19a687e2449603e5671695f27fd8c187c5fff7b738a324a9f75206c3",
          "metrics": {
            "detail": "observability service is present in architecture"
          }
        }
      ],
      "artifacts": [
        {
          "type": "manifest",
          "url": "solution-plays/14-cost-optimized-ai-gateway/spec/fai-manifest.json",
          "sha256": "78a41d427f198d5567b35461c74cf6081d0454b31d82850b5553ffa7fd3d6c11",
          "media_type": "application/json"
        },
        {
          "type": "architecture",
          "url": "solution-plays/14-cost-optimized-ai-gateway/architecture.md",
          "sha256": "892cefde364121eb523d4a56d5b6889180dc423fabb3fcaea447923b2b7a162d",
          "media_type": "text/markdown"
        },
        {
          "type": "cost",
          "url": "solution-plays/14-cost-optimized-ai-gateway/cost.json",
          "sha256": "209fe90be85519c702ad926ee484f125e21c20bf1890e41a3620d04f632222c9",
          "media_type": "application/json"
        }
      ]
    }
  }
}
