{
  "$schema": "https://frootai.dev/schemas/solution-play-certification-evidence.v1.json",
  "schema_version": "1.0.0",
  "subject": {
    "play_id": "12",
    "slug": "12-model-serving-aks",
    "canonical_id": "frootai__12-model-serving-aks",
    "repository": "https://github.com/frootai/frootai",
    "commit_sha": "b189ed981c457918ff3b81c4c530b3dd47d5196c",
    "content_sha256": "2042cfb206f245295d9089438e6f8da671f0e0d8c9e0ac3976011f521f1acf48",
    "manifest_sha256": "4867a84c1df185fa54fa94a1a5cd84385630c7f2ef49e153fdf158aea5a29f75",
    "iac_sha256": "59ead957fddf86f01c7e9b764297ee91e34dd0e32a9ca829fb762ee93b914306",
    "evaluation_dataset_sha256": "5da0152d293b2b1bfec5231456690f43c744ca035a0c79b808dc4cfcb30862b4"
  },
  "policy": {
    "profile": "design-v1",
    "profile_sha256": "b0bc3c9e6fb86282d610e35b01b22e1d544f683f894f5ad73f2913aed7d7d0d0"
  },
  "generated_at": "2026-07-18T22:54:56.591Z",
  "stages": {
    "designed": {
      "status": "passed",
      "generated_at": "2026-07-18T22:54:56.591Z",
      "expires_at": "2026-08-17T22:54:56.591Z",
      "provenance": {
        "workflow": "local",
        "run_id": "local",
        "attempt": 1
      },
      "environment": {
        "class": "local",
        "tools": {
          "node": "v24.18.0"
        }
      },
      "checks": [
        {
          "id": "manifest",
          "status": "passed",
          "blocking": true,
          "output_sha256": "7550fcf708ff714e9910858cc3cdbe35ced16425ae1b05f4633d2a5f386d990f",
          "metrics": {
            "detail": "engine loaded 12-model-serving-aks"
          }
        },
        {
          "id": "references",
          "status": "passed",
          "blocking": true,
          "output_sha256": "860349291c97b5d74c32474d2d069f363387409acf79c1de7f0565c719e2b5d3",
          "metrics": {
            "detail": "all declared references resolve"
          }
        },
        {
          "id": "architecture",
          "status": "passed",
          "blocking": true,
          "output_sha256": "2d3f6064549b5e08b5c2358372a1083d445fd16eeb411e84d898a74e55da25ca",
          "metrics": {
            "detail": "diagram, service roles, and security are declared"
          }
        },
        {
          "id": "cost",
          "status": "passed",
          "blocking": true,
          "output_sha256": "ed2d3273acb8bbfc77e3c68d02e284233ad4b89570cb019e09c81477bb453655",
          "metrics": {
            "detail": "component totals reconcile for dev, prod, and enterprise"
          }
        },
        {
          "id": "iac-declaration",
          "status": "passed",
          "blocking": true,
          "output_sha256": "05e0cfa7dce53e00eed918f313aceec9552f03be852ab8a9c7f7e6ee6bd10895",
          "metrics": {
            "detail": "./infra/main.bicep"
          }
        },
        {
          "id": "evaluation-declaration",
          "status": "passed",
          "blocking": true,
          "output_sha256": "3f3e286fc5b64213c1eb925a2041fd38e6f045ec4c5cf7f7a57e5ead4a642db4",
          "metrics": {
            "detail": "evaluation entry point exists"
          }
        },
        {
          "id": "observability-declaration",
          "status": "passed",
          "blocking": true,
          "output_sha256": "87c4f1fc19a687e2449603e5671695f27fd8c187c5fff7b738a324a9f75206c3",
          "metrics": {
            "detail": "observability service is present in architecture"
          }
        }
      ],
      "artifacts": [
        {
          "type": "manifest",
          "url": "solution-plays/12-model-serving-aks/spec/fai-manifest.json",
          "sha256": "4867a84c1df185fa54fa94a1a5cd84385630c7f2ef49e153fdf158aea5a29f75",
          "media_type": "application/json"
        },
        {
          "type": "architecture",
          "url": "solution-plays/12-model-serving-aks/architecture.md",
          "sha256": "520c65464427c0a552343b02d84bd7e205c8a6de41b50be29495b8063fa2b3f4",
          "media_type": "text/markdown"
        },
        {
          "type": "cost",
          "url": "solution-plays/12-model-serving-aks/cost.json",
          "sha256": "b9b6bd1cca1ac339bec834a471862f660843d5c091b1eee5fd835cf213e8f410",
          "media_type": "application/json"
        }
      ]
    }
  }
}
