{
  "$schema": "https://frootai.dev/schemas/solution-play-certification-evidence.v1.json",
  "schema_version": "1.0.0",
  "subject": {
    "play_id": "18",
    "slug": "18-prompt-management",
    "canonical_id": "frootai__18-prompt-management",
    "repository": "https://github.com/frootai/frootai",
    "commit_sha": "5c2f1068f62a65a242e7460f6dc6aa85bc8e163a",
    "content_sha256": "4d74310927a3a099f1e36b59ed1b650066d5b68956b8900d18f567d37e0a669b",
    "manifest_sha256": "b2bd1ab0758bd8363df347d29efe2279c0e78bc4b27d9ef74f4d5d1fdcd73609",
    "iac_sha256": "7907ddf63354b18897cc5031f05a2d94d4e14dfa6acff0de828092053323d15d",
    "evaluation_dataset_sha256": "174814d7beaaefc66bcfe5be26a6aa2d43ad2fd9fafc41b99efde6e1d4c13363"
  },
  "policy": {
    "profile": "design-v1",
    "profile_sha256": "b0bc3c9e6fb86282d610e35b01b22e1d544f683f894f5ad73f2913aed7d7d0d0"
  },
  "generated_at": "2026-07-27T06:26:06.692Z",
  "stages": {
    "designed": {
      "status": "passed",
      "generated_at": "2026-07-27T06:26:06.692Z",
      "expires_at": "2026-08-26T06:26:06.692Z",
      "provenance": {
        "workflow": "local",
        "run_id": "local",
        "attempt": 1
      },
      "environment": {
        "class": "local",
        "tools": {
          "node": "v24.18.0"
        }
      },
      "checks": [
        {
          "id": "manifest",
          "status": "passed",
          "blocking": true,
          "output_sha256": "32f77f86f82f53701daf596ba08aeb413498a73dd77ea5e4338edb283e083400",
          "metrics": {
            "detail": "engine loaded 18-prompt-management"
          }
        },
        {
          "id": "references",
          "status": "passed",
          "blocking": true,
          "output_sha256": "860349291c97b5d74c32474d2d069f363387409acf79c1de7f0565c719e2b5d3",
          "metrics": {
            "detail": "all declared references resolve"
          }
        },
        {
          "id": "architecture",
          "status": "passed",
          "blocking": true,
          "output_sha256": "2d3f6064549b5e08b5c2358372a1083d445fd16eeb411e84d898a74e55da25ca",
          "metrics": {
            "detail": "diagram, service roles, and security are declared"
          }
        },
        {
          "id": "cost",
          "status": "passed",
          "blocking": true,
          "output_sha256": "ed2d3273acb8bbfc77e3c68d02e284233ad4b89570cb019e09c81477bb453655",
          "metrics": {
            "detail": "component totals reconcile for dev, prod, and enterprise"
          }
        },
        {
          "id": "iac-declaration",
          "status": "passed",
          "blocking": true,
          "output_sha256": "05e0cfa7dce53e00eed918f313aceec9552f03be852ab8a9c7f7e6ee6bd10895",
          "metrics": {
            "detail": "./infra/main.bicep"
          }
        },
        {
          "id": "evaluation-declaration",
          "status": "passed",
          "blocking": true,
          "output_sha256": "3f3e286fc5b64213c1eb925a2041fd38e6f045ec4c5cf7f7a57e5ead4a642db4",
          "metrics": {
            "detail": "evaluation entry point exists"
          }
        },
        {
          "id": "observability-declaration",
          "status": "passed",
          "blocking": true,
          "output_sha256": "87c4f1fc19a687e2449603e5671695f27fd8c187c5fff7b738a324a9f75206c3",
          "metrics": {
            "detail": "observability service is present in architecture"
          }
        }
      ],
      "artifacts": [
        {
          "type": "manifest",
          "url": "solution-plays/18-prompt-management/spec/fai-manifest.json",
          "sha256": "b2bd1ab0758bd8363df347d29efe2279c0e78bc4b27d9ef74f4d5d1fdcd73609",
          "media_type": "application/json"
        },
        {
          "type": "architecture",
          "url": "solution-plays/18-prompt-management/architecture.md",
          "sha256": "8054adb137e07bbff0af09150dad200d5772b6a1b592d35f437dadfe071f4eac",
          "media_type": "text/markdown"
        },
        {
          "type": "cost",
          "url": "solution-plays/18-prompt-management/cost.json",
          "sha256": "5b1029ef70f0164a1efe27114c3c57fcaafb38f73eb17a66e51a77f26b0cb9e7",
          "media_type": "application/json"
        }
      ]
    }
  }
}
