{
  "$schema": "https://frootai.dev/schemas/solution-play-certification-evidence.v1.json",
  "schema_version": "1.0.0",
  "subject": {
    "play_id": "37",
    "slug": "37-ai-powered-devops",
    "canonical_id": "frootai__37-ai-powered-devops",
    "repository": "https://github.com/frootai/frootai",
    "commit_sha": "5c2f1068f62a65a242e7460f6dc6aa85bc8e163a",
    "content_sha256": "8c57c4600b9af186ab52ff23adbd9580c0c88fbae0421bba1b79925a8bd40781",
    "manifest_sha256": "6ee705a6896e94f7e0a58b9e638b82f01d370b14864c563c22ac7b64eec8c256",
    "iac_sha256": "bf5d90e36dcb9d4bfeb2282ea6eb508ffa4dbe754afff693a24b410bdf7f01dc",
    "evaluation_dataset_sha256": "63e4e7963bda6febbafcde868186700dc0fb05676c5e05066305a335e61f8d86"
  },
  "policy": {
    "profile": "design-v1",
    "profile_sha256": "b0bc3c9e6fb86282d610e35b01b22e1d544f683f894f5ad73f2913aed7d7d0d0"
  },
  "generated_at": "2026-07-27T06:26:06.692Z",
  "stages": {
    "designed": {
      "status": "passed",
      "generated_at": "2026-07-27T06:26:06.692Z",
      "expires_at": "2026-08-26T06:26:06.692Z",
      "provenance": {
        "workflow": "local",
        "run_id": "local",
        "attempt": 1
      },
      "environment": {
        "class": "local",
        "tools": {
          "node": "v24.18.0"
        }
      },
      "checks": [
        {
          "id": "manifest",
          "status": "passed",
          "blocking": true,
          "output_sha256": "59717366dac542eed298254274b5a8faaea11b57cb62dce5945edaea7eec4b1e",
          "metrics": {
            "detail": "engine loaded 37-ai-powered-devops"
          }
        },
        {
          "id": "references",
          "status": "passed",
          "blocking": true,
          "output_sha256": "860349291c97b5d74c32474d2d069f363387409acf79c1de7f0565c719e2b5d3",
          "metrics": {
            "detail": "all declared references resolve"
          }
        },
        {
          "id": "architecture",
          "status": "passed",
          "blocking": true,
          "output_sha256": "2d3f6064549b5e08b5c2358372a1083d445fd16eeb411e84d898a74e55da25ca",
          "metrics": {
            "detail": "diagram, service roles, and security are declared"
          }
        },
        {
          "id": "cost",
          "status": "passed",
          "blocking": true,
          "output_sha256": "ed2d3273acb8bbfc77e3c68d02e284233ad4b89570cb019e09c81477bb453655",
          "metrics": {
            "detail": "component totals reconcile for dev, prod, and enterprise"
          }
        },
        {
          "id": "iac-declaration",
          "status": "passed",
          "blocking": true,
          "output_sha256": "05e0cfa7dce53e00eed918f313aceec9552f03be852ab8a9c7f7e6ee6bd10895",
          "metrics": {
            "detail": "./infra/main.bicep"
          }
        },
        {
          "id": "evaluation-declaration",
          "status": "passed",
          "blocking": true,
          "output_sha256": "3f3e286fc5b64213c1eb925a2041fd38e6f045ec4c5cf7f7a57e5ead4a642db4",
          "metrics": {
            "detail": "evaluation entry point exists"
          }
        },
        {
          "id": "observability-declaration",
          "status": "passed",
          "blocking": true,
          "output_sha256": "87c4f1fc19a687e2449603e5671695f27fd8c187c5fff7b738a324a9f75206c3",
          "metrics": {
            "detail": "observability service is present in architecture"
          }
        }
      ],
      "artifacts": [
        {
          "type": "manifest",
          "url": "solution-plays/37-ai-powered-devops/spec/fai-manifest.json",
          "sha256": "6ee705a6896e94f7e0a58b9e638b82f01d370b14864c563c22ac7b64eec8c256",
          "media_type": "application/json"
        },
        {
          "type": "architecture",
          "url": "solution-plays/37-ai-powered-devops/architecture.md",
          "sha256": "0fc90e7faf424d753e5a4ed68809e4a5daefb070d2c0a00c16ed9b270dcb1c4a",
          "media_type": "text/markdown"
        },
        {
          "type": "cost",
          "url": "solution-plays/37-ai-powered-devops/cost.json",
          "sha256": "5c1a8c235b22d5132c0ca28c4450d17f8b4fa7b21add624fa73f312d6aa8cc63",
          "media_type": "application/json"
        }
      ]
    }
  }
}
