{
  "$schema": "https://frootai.dev/schemas/solution-play-certification-evidence.v1.json",
  "schema_version": "1.0.0",
  "subject": {
    "play_id": "60",
    "slug": "60-responsible-ai-dashboard",
    "canonical_id": "frootai__60-responsible-ai-dashboard",
    "repository": "https://github.com/frootai/frootai",
    "commit_sha": "5c2f1068f62a65a242e7460f6dc6aa85bc8e163a",
    "content_sha256": "d6852ee243b12a0edde3469bedbe8c105df70f991ddb24cbd7b2e15ec407f099",
    "manifest_sha256": "89d84c3c5bac821d71df2a22fc68664a1edb7d36c59c6d7602d6bf1336b3317f",
    "iac_sha256": "566d4cca5c32295a6945a1606d80795934e6fbbc8a69842f436a2130cec42d22",
    "evaluation_dataset_sha256": "81f50cd697b6b2aa84731c06d4f9ccfefb2ec799ee9b4dcd65a231cca18f2d98"
  },
  "policy": {
    "profile": "design-v1",
    "profile_sha256": "b0bc3c9e6fb86282d610e35b01b22e1d544f683f894f5ad73f2913aed7d7d0d0"
  },
  "generated_at": "2026-07-27T06:26:06.692Z",
  "stages": {
    "designed": {
      "status": "passed",
      "generated_at": "2026-07-27T06:26:06.692Z",
      "expires_at": "2026-08-26T06:26:06.692Z",
      "provenance": {
        "workflow": "local",
        "run_id": "local",
        "attempt": 1
      },
      "environment": {
        "class": "local",
        "tools": {
          "node": "v24.18.0"
        }
      },
      "checks": [
        {
          "id": "manifest",
          "status": "passed",
          "blocking": true,
          "output_sha256": "7134d4be121ef8fcf91410dac18b66391d873cf72d31707a2e4298a4356e6113",
          "metrics": {
            "detail": "engine loaded 60-responsible-ai-dashboard"
          }
        },
        {
          "id": "references",
          "status": "passed",
          "blocking": true,
          "output_sha256": "860349291c97b5d74c32474d2d069f363387409acf79c1de7f0565c719e2b5d3",
          "metrics": {
            "detail": "all declared references resolve"
          }
        },
        {
          "id": "architecture",
          "status": "passed",
          "blocking": true,
          "output_sha256": "2d3f6064549b5e08b5c2358372a1083d445fd16eeb411e84d898a74e55da25ca",
          "metrics": {
            "detail": "diagram, service roles, and security are declared"
          }
        },
        {
          "id": "cost",
          "status": "passed",
          "blocking": true,
          "output_sha256": "ed2d3273acb8bbfc77e3c68d02e284233ad4b89570cb019e09c81477bb453655",
          "metrics": {
            "detail": "component totals reconcile for dev, prod, and enterprise"
          }
        },
        {
          "id": "iac-declaration",
          "status": "passed",
          "blocking": true,
          "output_sha256": "05e0cfa7dce53e00eed918f313aceec9552f03be852ab8a9c7f7e6ee6bd10895",
          "metrics": {
            "detail": "./infra/main.bicep"
          }
        },
        {
          "id": "evaluation-declaration",
          "status": "passed",
          "blocking": true,
          "output_sha256": "3f3e286fc5b64213c1eb925a2041fd38e6f045ec4c5cf7f7a57e5ead4a642db4",
          "metrics": {
            "detail": "evaluation entry point exists"
          }
        },
        {
          "id": "observability-declaration",
          "status": "passed",
          "blocking": true,
          "output_sha256": "87c4f1fc19a687e2449603e5671695f27fd8c187c5fff7b738a324a9f75206c3",
          "metrics": {
            "detail": "observability service is present in architecture"
          }
        }
      ],
      "artifacts": [
        {
          "type": "manifest",
          "url": "solution-plays/60-responsible-ai-dashboard/spec/fai-manifest.json",
          "sha256": "89d84c3c5bac821d71df2a22fc68664a1edb7d36c59c6d7602d6bf1336b3317f",
          "media_type": "application/json"
        },
        {
          "type": "architecture",
          "url": "solution-plays/60-responsible-ai-dashboard/architecture.md",
          "sha256": "2cbda2d00fc62c4abce77b1ff19ed07d48bbd09138070931bf33a676410aed9e",
          "media_type": "text/markdown"
        },
        {
          "type": "cost",
          "url": "solution-plays/60-responsible-ai-dashboard/cost.json",
          "sha256": "9e0366f619dcab3cb0a186ded241aa42ba098175ef881d51357d8c64e15e4829",
          "media_type": "application/json"
        }
      ]
    }
  }
}
