{
  "$schema": "https://frootai.dev/schemas/solution-play-certification-evidence.v1.json",
  "schema_version": "1.0.0",
  "subject": {
    "play_id": "21",
    "slug": "21-agentic-rag",
    "canonical_id": "frootai__21-agentic-rag",
    "repository": "https://github.com/frootai/frootai",
    "commit_sha": "5c2f1068f62a65a242e7460f6dc6aa85bc8e163a",
    "content_sha256": "ea683f4dc1419e8da698a8c91978eaf8eaece01fec34356b1905c5fc7b144875",
    "manifest_sha256": "267ce33cf4d518f3ccce2910e462c706289628d57db389d87b9939c8d7448399",
    "iac_sha256": "79caaa2ca5d6a691f098381879f021db2984df0f10a5e175c4e360358008b650",
    "evaluation_dataset_sha256": "5de48bb83e3af1d00ef84439e6336178c7764e398aefddefdcd7ab114f61b19e"
  },
  "policy": {
    "profile": "design-v1",
    "profile_sha256": "b0bc3c9e6fb86282d610e35b01b22e1d544f683f894f5ad73f2913aed7d7d0d0"
  },
  "generated_at": "2026-07-27T06:26:06.692Z",
  "stages": {
    "designed": {
      "status": "passed",
      "generated_at": "2026-07-27T06:26:06.692Z",
      "expires_at": "2026-08-26T06:26:06.692Z",
      "provenance": {
        "workflow": "local",
        "run_id": "local",
        "attempt": 1
      },
      "environment": {
        "class": "local",
        "tools": {
          "node": "v24.18.0"
        }
      },
      "checks": [
        {
          "id": "manifest",
          "status": "passed",
          "blocking": true,
          "output_sha256": "474ed347dda8ead7b2fdeeb072aac6f6bb2c0f5395534c52bee4ca56c9d78aae",
          "metrics": {
            "detail": "engine loaded 21-agentic-rag"
          }
        },
        {
          "id": "references",
          "status": "passed",
          "blocking": true,
          "output_sha256": "860349291c97b5d74c32474d2d069f363387409acf79c1de7f0565c719e2b5d3",
          "metrics": {
            "detail": "all declared references resolve"
          }
        },
        {
          "id": "architecture",
          "status": "passed",
          "blocking": true,
          "output_sha256": "2d3f6064549b5e08b5c2358372a1083d445fd16eeb411e84d898a74e55da25ca",
          "metrics": {
            "detail": "diagram, service roles, and security are declared"
          }
        },
        {
          "id": "cost",
          "status": "passed",
          "blocking": true,
          "output_sha256": "ed2d3273acb8bbfc77e3c68d02e284233ad4b89570cb019e09c81477bb453655",
          "metrics": {
            "detail": "component totals reconcile for dev, prod, and enterprise"
          }
        },
        {
          "id": "iac-declaration",
          "status": "passed",
          "blocking": true,
          "output_sha256": "05e0cfa7dce53e00eed918f313aceec9552f03be852ab8a9c7f7e6ee6bd10895",
          "metrics": {
            "detail": "./infra/main.bicep"
          }
        },
        {
          "id": "evaluation-declaration",
          "status": "passed",
          "blocking": true,
          "output_sha256": "3f3e286fc5b64213c1eb925a2041fd38e6f045ec4c5cf7f7a57e5ead4a642db4",
          "metrics": {
            "detail": "evaluation entry point exists"
          }
        },
        {
          "id": "observability-declaration",
          "status": "passed",
          "blocking": true,
          "output_sha256": "87c4f1fc19a687e2449603e5671695f27fd8c187c5fff7b738a324a9f75206c3",
          "metrics": {
            "detail": "observability service is present in architecture"
          }
        }
      ],
      "artifacts": [
        {
          "type": "manifest",
          "url": "solution-plays/21-agentic-rag/spec/fai-manifest.json",
          "sha256": "267ce33cf4d518f3ccce2910e462c706289628d57db389d87b9939c8d7448399",
          "media_type": "application/json"
        },
        {
          "type": "architecture",
          "url": "solution-plays/21-agentic-rag/architecture.md",
          "sha256": "b7bab91a22ae8de815314ea8b8947e030ede8a92c800f7d3d354c25ad10c6de3",
          "media_type": "text/markdown"
        },
        {
          "type": "cost",
          "url": "solution-plays/21-agentic-rag/cost.json",
          "sha256": "e6445d278cc8ee2db005c6ef5b1d1c13af13d8a3c9242419017695ce2833b26f",
          "media_type": "application/json"
        }
      ]
    }
  }
}
