{
  "$schema": "https://frootai.dev/schemas/solution-play-certification-evidence.v1.json",
  "schema_version": "1.0.0",
  "subject": {
    "play_id": "26",
    "slug": "26-semantic-search-engine",
    "canonical_id": "frootai__26-semantic-search-engine",
    "repository": "https://github.com/frootai/frootai",
    "commit_sha": "b189ed981c457918ff3b81c4c530b3dd47d5196c",
    "content_sha256": "8facbd0244c03bd7854d61335e07dbe5f7a7610fb71579a1fbfe895309a47468",
    "manifest_sha256": "f05b406f11be381358b2932460797b3a84804fb78f4746bee12ca817a42c14b9",
    "iac_sha256": "4aa9186e3782cb5af9766a41022983432b0a2a87a20be9b7ced15e1dc127a769",
    "evaluation_dataset_sha256": "e48ede642b5c461219f429242ed985f16ac96c31e1b0cfdc78493c3a55224be8"
  },
  "policy": {
    "profile": "design-v1",
    "profile_sha256": "b0bc3c9e6fb86282d610e35b01b22e1d544f683f894f5ad73f2913aed7d7d0d0"
  },
  "generated_at": "2026-07-18T22:54:56.591Z",
  "stages": {
    "designed": {
      "status": "passed",
      "generated_at": "2026-07-18T22:54:56.591Z",
      "expires_at": "2026-08-17T22:54:56.591Z",
      "provenance": {
        "workflow": "local",
        "run_id": "local",
        "attempt": 1
      },
      "environment": {
        "class": "local",
        "tools": {
          "node": "v24.18.0"
        }
      },
      "checks": [
        {
          "id": "manifest",
          "status": "passed",
          "blocking": true,
          "output_sha256": "e15508d828be0a9ed3212ae6fc574692d0f8c2bfbe17324ab863bb049b70ecf2",
          "metrics": {
            "detail": "engine loaded 26-semantic-search-engine"
          }
        },
        {
          "id": "references",
          "status": "passed",
          "blocking": true,
          "output_sha256": "860349291c97b5d74c32474d2d069f363387409acf79c1de7f0565c719e2b5d3",
          "metrics": {
            "detail": "all declared references resolve"
          }
        },
        {
          "id": "architecture",
          "status": "passed",
          "blocking": true,
          "output_sha256": "2d3f6064549b5e08b5c2358372a1083d445fd16eeb411e84d898a74e55da25ca",
          "metrics": {
            "detail": "diagram, service roles, and security are declared"
          }
        },
        {
          "id": "cost",
          "status": "passed",
          "blocking": true,
          "output_sha256": "ed2d3273acb8bbfc77e3c68d02e284233ad4b89570cb019e09c81477bb453655",
          "metrics": {
            "detail": "component totals reconcile for dev, prod, and enterprise"
          }
        },
        {
          "id": "iac-declaration",
          "status": "passed",
          "blocking": true,
          "output_sha256": "05e0cfa7dce53e00eed918f313aceec9552f03be852ab8a9c7f7e6ee6bd10895",
          "metrics": {
            "detail": "./infra/main.bicep"
          }
        },
        {
          "id": "evaluation-declaration",
          "status": "passed",
          "blocking": true,
          "output_sha256": "3f3e286fc5b64213c1eb925a2041fd38e6f045ec4c5cf7f7a57e5ead4a642db4",
          "metrics": {
            "detail": "evaluation entry point exists"
          }
        },
        {
          "id": "observability-declaration",
          "status": "passed",
          "blocking": true,
          "output_sha256": "87c4f1fc19a687e2449603e5671695f27fd8c187c5fff7b738a324a9f75206c3",
          "metrics": {
            "detail": "observability service is present in architecture"
          }
        }
      ],
      "artifacts": [
        {
          "type": "manifest",
          "url": "solution-plays/26-semantic-search-engine/spec/fai-manifest.json",
          "sha256": "f05b406f11be381358b2932460797b3a84804fb78f4746bee12ca817a42c14b9",
          "media_type": "application/json"
        },
        {
          "type": "architecture",
          "url": "solution-plays/26-semantic-search-engine/architecture.md",
          "sha256": "227d9fdc0bdb932cfc2619ba7cefe6341b099326a5846626b5a177d09cef3b3c",
          "media_type": "text/markdown"
        },
        {
          "type": "cost",
          "url": "solution-plays/26-semantic-search-engine/cost.json",
          "sha256": "a67e87f3f7891bc14d92eb32c1b75b6c3db6e2e8e77be21d9c63b5a96d3ed40b",
          "media_type": "application/json"
        }
      ]
    }
  }
}
