{
  "$schema": "https://frootai.dev/schemas/solution-play-certification-evidence.v1.json",
  "schema_version": "1.0.0",
  "subject": {
    "play_id": "48",
    "slug": "48-ai-model-governance",
    "canonical_id": "frootai__48-ai-model-governance",
    "repository": "https://github.com/frootai/frootai",
    "commit_sha": "b189ed981c457918ff3b81c4c530b3dd47d5196c",
    "content_sha256": "643eda8b08aa7e629a16632521eb069d90290278cb85f1ee8beaca3d1c0f0b41",
    "manifest_sha256": "b865b40ecaff7617829e685ae203d128c254b07dc9eb35021786f7590581b258",
    "iac_sha256": "140148230611ff81e3a3b158a74a9b0a318be1c15e06f761dd99ce59803b026d",
    "evaluation_dataset_sha256": "19fd24d47a296be1244f3840b6c8c3c2d4d04af017e88914bee59bef1bcde315"
  },
  "policy": {
    "profile": "design-v1",
    "profile_sha256": "b0bc3c9e6fb86282d610e35b01b22e1d544f683f894f5ad73f2913aed7d7d0d0"
  },
  "generated_at": "2026-07-18T22:54:56.591Z",
  "stages": {
    "designed": {
      "status": "passed",
      "generated_at": "2026-07-18T22:54:56.591Z",
      "expires_at": "2026-08-17T22:54:56.591Z",
      "provenance": {
        "workflow": "local",
        "run_id": "local",
        "attempt": 1
      },
      "environment": {
        "class": "local",
        "tools": {
          "node": "v24.18.0"
        }
      },
      "checks": [
        {
          "id": "manifest",
          "status": "passed",
          "blocking": true,
          "output_sha256": "21e71842615ea1c4c5a20fc14d327715c35f6e57cd507135e75372c915daf427",
          "metrics": {
            "detail": "engine loaded 48-ai-model-governance"
          }
        },
        {
          "id": "references",
          "status": "passed",
          "blocking": true,
          "output_sha256": "860349291c97b5d74c32474d2d069f363387409acf79c1de7f0565c719e2b5d3",
          "metrics": {
            "detail": "all declared references resolve"
          }
        },
        {
          "id": "architecture",
          "status": "passed",
          "blocking": true,
          "output_sha256": "2d3f6064549b5e08b5c2358372a1083d445fd16eeb411e84d898a74e55da25ca",
          "metrics": {
            "detail": "diagram, service roles, and security are declared"
          }
        },
        {
          "id": "cost",
          "status": "passed",
          "blocking": true,
          "output_sha256": "ed2d3273acb8bbfc77e3c68d02e284233ad4b89570cb019e09c81477bb453655",
          "metrics": {
            "detail": "component totals reconcile for dev, prod, and enterprise"
          }
        },
        {
          "id": "iac-declaration",
          "status": "passed",
          "blocking": true,
          "output_sha256": "05e0cfa7dce53e00eed918f313aceec9552f03be852ab8a9c7f7e6ee6bd10895",
          "metrics": {
            "detail": "./infra/main.bicep"
          }
        },
        {
          "id": "evaluation-declaration",
          "status": "passed",
          "blocking": true,
          "output_sha256": "3f3e286fc5b64213c1eb925a2041fd38e6f045ec4c5cf7f7a57e5ead4a642db4",
          "metrics": {
            "detail": "evaluation entry point exists"
          }
        },
        {
          "id": "observability-declaration",
          "status": "passed",
          "blocking": true,
          "output_sha256": "87c4f1fc19a687e2449603e5671695f27fd8c187c5fff7b738a324a9f75206c3",
          "metrics": {
            "detail": "observability service is present in architecture"
          }
        }
      ],
      "artifacts": [
        {
          "type": "manifest",
          "url": "solution-plays/48-ai-model-governance/spec/fai-manifest.json",
          "sha256": "b865b40ecaff7617829e685ae203d128c254b07dc9eb35021786f7590581b258",
          "media_type": "application/json"
        },
        {
          "type": "architecture",
          "url": "solution-plays/48-ai-model-governance/architecture.md",
          "sha256": "cdfa3131a8482d4fd43b3af80da276a713844fe678deffbff2c5f01343d08f2d",
          "media_type": "text/markdown"
        },
        {
          "type": "cost",
          "url": "solution-plays/48-ai-model-governance/cost.json",
          "sha256": "e0ecc8a43d747280055ceaa19d9ba38702cd0921b6ac0c66c00996f2afeff112",
          "media_type": "application/json"
        }
      ]
    }
  }
}
