{
  "$schema": "https://frootai.dev/schemas/solution-play-certification-evidence.v1.json",
  "schema_version": "1.0.0",
  "subject": {
    "play_id": "24",
    "slug": "24-ai-code-review-pipeline",
    "canonical_id": "frootai__24-ai-code-review-pipeline",
    "repository": "https://github.com/frootai/frootai",
    "commit_sha": "b189ed981c457918ff3b81c4c530b3dd47d5196c",
    "content_sha256": "4907b20217ca1864ec3d56a0674eb0afdd581b59fe7f0050ede7ba96de5feb9d",
    "manifest_sha256": "dc132a43fee85e9eef914c610dd1a357514f2257b251d1fd6d9f92d410ef62fa",
    "iac_sha256": "0d1be0b5bb6bfeaa23b52b793d2938f485c9dc38bb3e53cf5784e8fcc657e770",
    "evaluation_dataset_sha256": "ec3e49b32ca9a56d853dc93df4b12c7ae3fb7cb28197da420d6f8cda963a81cd"
  },
  "policy": {
    "profile": "design-v1",
    "profile_sha256": "b0bc3c9e6fb86282d610e35b01b22e1d544f683f894f5ad73f2913aed7d7d0d0"
  },
  "generated_at": "2026-07-18T22:54:56.591Z",
  "stages": {
    "designed": {
      "status": "passed",
      "generated_at": "2026-07-18T22:54:56.591Z",
      "expires_at": "2026-08-17T22:54:56.591Z",
      "provenance": {
        "workflow": "local",
        "run_id": "local",
        "attempt": 1
      },
      "environment": {
        "class": "local",
        "tools": {
          "node": "v24.18.0"
        }
      },
      "checks": [
        {
          "id": "manifest",
          "status": "passed",
          "blocking": true,
          "output_sha256": "1bd7c5099331a02edcda07f67a5dfce927104232abf8fd340cbdc9998bfde5a6",
          "metrics": {
            "detail": "engine loaded 24-ai-code-review-pipeline"
          }
        },
        {
          "id": "references",
          "status": "passed",
          "blocking": true,
          "output_sha256": "860349291c97b5d74c32474d2d069f363387409acf79c1de7f0565c719e2b5d3",
          "metrics": {
            "detail": "all declared references resolve"
          }
        },
        {
          "id": "architecture",
          "status": "passed",
          "blocking": true,
          "output_sha256": "2d3f6064549b5e08b5c2358372a1083d445fd16eeb411e84d898a74e55da25ca",
          "metrics": {
            "detail": "diagram, service roles, and security are declared"
          }
        },
        {
          "id": "cost",
          "status": "passed",
          "blocking": true,
          "output_sha256": "ed2d3273acb8bbfc77e3c68d02e284233ad4b89570cb019e09c81477bb453655",
          "metrics": {
            "detail": "component totals reconcile for dev, prod, and enterprise"
          }
        },
        {
          "id": "iac-declaration",
          "status": "passed",
          "blocking": true,
          "output_sha256": "05e0cfa7dce53e00eed918f313aceec9552f03be852ab8a9c7f7e6ee6bd10895",
          "metrics": {
            "detail": "./infra/main.bicep"
          }
        },
        {
          "id": "evaluation-declaration",
          "status": "passed",
          "blocking": true,
          "output_sha256": "3f3e286fc5b64213c1eb925a2041fd38e6f045ec4c5cf7f7a57e5ead4a642db4",
          "metrics": {
            "detail": "evaluation entry point exists"
          }
        },
        {
          "id": "observability-declaration",
          "status": "passed",
          "blocking": true,
          "output_sha256": "87c4f1fc19a687e2449603e5671695f27fd8c187c5fff7b738a324a9f75206c3",
          "metrics": {
            "detail": "observability service is present in architecture"
          }
        }
      ],
      "artifacts": [
        {
          "type": "manifest",
          "url": "solution-plays/24-ai-code-review-pipeline/spec/fai-manifest.json",
          "sha256": "dc132a43fee85e9eef914c610dd1a357514f2257b251d1fd6d9f92d410ef62fa",
          "media_type": "application/json"
        },
        {
          "type": "architecture",
          "url": "solution-plays/24-ai-code-review-pipeline/architecture.md",
          "sha256": "54f3a7eeac68477e5e83b4dfc8176ef4ab3a538694d64bb80e04838ed93e3622",
          "media_type": "text/markdown"
        },
        {
          "type": "cost",
          "url": "solution-plays/24-ai-code-review-pipeline/cost.json",
          "sha256": "d8c0ef7f7cb0e4c1e78d7846f37e99b86158711d01c422540da2d8f292e8f3ef",
          "media_type": "application/json"
        }
      ]
    }
  }
}
