{
  "$schema": "https://frootai.dev/schemas/solution-play-certification-evidence.v1.json",
  "schema_version": "1.0.0",
  "subject": {
    "play_id": "51",
    "slug": "51-autonomous-coding-agent",
    "canonical_id": "frootai__51-autonomous-coding-agent",
    "repository": "https://github.com/frootai/frootai",
    "commit_sha": "b189ed981c457918ff3b81c4c530b3dd47d5196c",
    "content_sha256": "bd9b8e1e9b79d9af7cd9902950f7081514e983e658d4d10341fcae4ccb1d04bf",
    "manifest_sha256": "1ec3496148b59a0b39593a06ce5f94adc044cc7d0ff3479ce18df55c8260ff72",
    "iac_sha256": "8cd6d5ceeb2820efc7d2797025a450b69f7ccdf7c87742f27e6a4611156ea6d1",
    "evaluation_dataset_sha256": "ed0a0bd6da7a8ec925fa729bc35955d39b5398c02cbb7904984385faf5720d78"
  },
  "policy": {
    "profile": "design-v1",
    "profile_sha256": "b0bc3c9e6fb86282d610e35b01b22e1d544f683f894f5ad73f2913aed7d7d0d0"
  },
  "generated_at": "2026-07-18T22:54:56.591Z",
  "stages": {
    "designed": {
      "status": "passed",
      "generated_at": "2026-07-18T22:54:56.591Z",
      "expires_at": "2026-08-17T22:54:56.591Z",
      "provenance": {
        "workflow": "local",
        "run_id": "local",
        "attempt": 1
      },
      "environment": {
        "class": "local",
        "tools": {
          "node": "v24.18.0"
        }
      },
      "checks": [
        {
          "id": "manifest",
          "status": "passed",
          "blocking": true,
          "output_sha256": "91d3839f43456bd1934493a5aca692ff2a85164175a8211ba4531e34bdcb116e",
          "metrics": {
            "detail": "engine loaded 51-autonomous-coding-agent"
          }
        },
        {
          "id": "references",
          "status": "passed",
          "blocking": true,
          "output_sha256": "860349291c97b5d74c32474d2d069f363387409acf79c1de7f0565c719e2b5d3",
          "metrics": {
            "detail": "all declared references resolve"
          }
        },
        {
          "id": "architecture",
          "status": "passed",
          "blocking": true,
          "output_sha256": "2d3f6064549b5e08b5c2358372a1083d445fd16eeb411e84d898a74e55da25ca",
          "metrics": {
            "detail": "diagram, service roles, and security are declared"
          }
        },
        {
          "id": "cost",
          "status": "passed",
          "blocking": true,
          "output_sha256": "ed2d3273acb8bbfc77e3c68d02e284233ad4b89570cb019e09c81477bb453655",
          "metrics": {
            "detail": "component totals reconcile for dev, prod, and enterprise"
          }
        },
        {
          "id": "iac-declaration",
          "status": "passed",
          "blocking": true,
          "output_sha256": "05e0cfa7dce53e00eed918f313aceec9552f03be852ab8a9c7f7e6ee6bd10895",
          "metrics": {
            "detail": "./infra/main.bicep"
          }
        },
        {
          "id": "evaluation-declaration",
          "status": "passed",
          "blocking": true,
          "output_sha256": "3f3e286fc5b64213c1eb925a2041fd38e6f045ec4c5cf7f7a57e5ead4a642db4",
          "metrics": {
            "detail": "evaluation entry point exists"
          }
        },
        {
          "id": "observability-declaration",
          "status": "passed",
          "blocking": true,
          "output_sha256": "87c4f1fc19a687e2449603e5671695f27fd8c187c5fff7b738a324a9f75206c3",
          "metrics": {
            "detail": "observability service is present in architecture"
          }
        }
      ],
      "artifacts": [
        {
          "type": "manifest",
          "url": "solution-plays/51-autonomous-coding-agent/spec/fai-manifest.json",
          "sha256": "1ec3496148b59a0b39593a06ce5f94adc044cc7d0ff3479ce18df55c8260ff72",
          "media_type": "application/json"
        },
        {
          "type": "architecture",
          "url": "solution-plays/51-autonomous-coding-agent/architecture.md",
          "sha256": "926896fc2d934116f5f0700bd639f8523f4c73fc0fa0e025a023bb4693a74795",
          "media_type": "text/markdown"
        },
        {
          "type": "cost",
          "url": "solution-plays/51-autonomous-coding-agent/cost.json",
          "sha256": "a01ed8333427dd83a4583a96b562b7b9a312e9b749cfd1ff3c1c9c08cb84d15f",
          "media_type": "application/json"
        }
      ]
    }
  }
}
