{
  "$schema": "https://frootai.dev/schemas/solution-play-certification-evidence.v1.json",
  "schema_version": "1.0.0",
  "subject": {
    "play_id": "53",
    "slug": "53-legal-document-ai",
    "canonical_id": "frootai__53-legal-document-ai",
    "repository": "https://github.com/frootai/frootai",
    "commit_sha": "5c2f1068f62a65a242e7460f6dc6aa85bc8e163a",
    "content_sha256": "4c299eec344eb6d93f2a480ab0f7532d6c6f98f138cbdfcb6d32e49820360547",
    "manifest_sha256": "614e2bc0efcabbfcd03e712152b0bdeae2ae5f5d541795c82d326da8fcb96747",
    "iac_sha256": "9ddd382f211ddc8a6bc5cd7975a48f9d23248cf273eb2215c7e4f7999d14f9ec",
    "evaluation_dataset_sha256": "0a0eb72950785339496c860cb30f923ea3b686d8018768475fe29bc68b4cc886"
  },
  "policy": {
    "profile": "design-v1",
    "profile_sha256": "b0bc3c9e6fb86282d610e35b01b22e1d544f683f894f5ad73f2913aed7d7d0d0"
  },
  "generated_at": "2026-07-27T06:26:06.692Z",
  "stages": {
    "designed": {
      "status": "passed",
      "generated_at": "2026-07-27T06:26:06.692Z",
      "expires_at": "2026-08-26T06:26:06.692Z",
      "provenance": {
        "workflow": "local",
        "run_id": "local",
        "attempt": 1
      },
      "environment": {
        "class": "local",
        "tools": {
          "node": "v24.18.0"
        }
      },
      "checks": [
        {
          "id": "manifest",
          "status": "passed",
          "blocking": true,
          "output_sha256": "68413713826b7cb96f8af92fc4548829779a88438d7a54bdd6947e1ab6d16e8d",
          "metrics": {
            "detail": "engine loaded 53-legal-document-ai"
          }
        },
        {
          "id": "references",
          "status": "passed",
          "blocking": true,
          "output_sha256": "860349291c97b5d74c32474d2d069f363387409acf79c1de7f0565c719e2b5d3",
          "metrics": {
            "detail": "all declared references resolve"
          }
        },
        {
          "id": "architecture",
          "status": "passed",
          "blocking": true,
          "output_sha256": "2d3f6064549b5e08b5c2358372a1083d445fd16eeb411e84d898a74e55da25ca",
          "metrics": {
            "detail": "diagram, service roles, and security are declared"
          }
        },
        {
          "id": "cost",
          "status": "passed",
          "blocking": true,
          "output_sha256": "ed2d3273acb8bbfc77e3c68d02e284233ad4b89570cb019e09c81477bb453655",
          "metrics": {
            "detail": "component totals reconcile for dev, prod, and enterprise"
          }
        },
        {
          "id": "iac-declaration",
          "status": "passed",
          "blocking": true,
          "output_sha256": "05e0cfa7dce53e00eed918f313aceec9552f03be852ab8a9c7f7e6ee6bd10895",
          "metrics": {
            "detail": "./infra/main.bicep"
          }
        },
        {
          "id": "evaluation-declaration",
          "status": "passed",
          "blocking": true,
          "output_sha256": "3f3e286fc5b64213c1eb925a2041fd38e6f045ec4c5cf7f7a57e5ead4a642db4",
          "metrics": {
            "detail": "evaluation entry point exists"
          }
        },
        {
          "id": "observability-declaration",
          "status": "passed",
          "blocking": true,
          "output_sha256": "87c4f1fc19a687e2449603e5671695f27fd8c187c5fff7b738a324a9f75206c3",
          "metrics": {
            "detail": "observability service is present in architecture"
          }
        }
      ],
      "artifacts": [
        {
          "type": "manifest",
          "url": "solution-plays/53-legal-document-ai/spec/fai-manifest.json",
          "sha256": "614e2bc0efcabbfcd03e712152b0bdeae2ae5f5d541795c82d326da8fcb96747",
          "media_type": "application/json"
        },
        {
          "type": "architecture",
          "url": "solution-plays/53-legal-document-ai/architecture.md",
          "sha256": "84629e556c8ce1eb4e0aa5ae54c37fc059ccfff721519796db5c121cb36af96e",
          "media_type": "text/markdown"
        },
        {
          "type": "cost",
          "url": "solution-plays/53-legal-document-ai/cost.json",
          "sha256": "9d5d9c08483c71bd2bb929a6d20ec86313db9a9e71a86658c150f9c53943a507",
          "media_type": "application/json"
        }
      ]
    }
  }
}
